{
  "version": "r30j1c.owner-correction-item.v1",
  "status": "EMPTY_TEMPLATE",
  "local_only": true,
  "must_remain_ignored": true,
  "correction_id": null,
  "source_family_ref": null,
  "split_family_ref": null,
  "target_hypothesis_refs": [],
  "evidence_refs": [],
  "information_goal": null,
  "question_family": null,
  "register_context": null,
  "topic_slice_ref": null,
  "question_text_local": null,
  "contains_source_excerpt": false,
  "review_actions": ["ACCEPT", "REJECT", "EDIT", "DEPENDS", "UNSURE"],
  "depends_requires_condition": true,
  "owner_response_present": false,
  "owner_review_status": "UNREVIEWED",
  "owner_review_required": true,
  "gold_admission": false,
  "allowed_for_training": false,
  "heldout_eligible": false
}
